<?xml version="1.0" encoding="UTF-8"?>
<xs:schema xmlns:xs="http://www.w3.org/2001/XMLSchema">
    <xs:element name="alumnos">
        <xs:complexType>
            <xs:sequence>
                <xs:element name="alumno" minOccurs="1" maxOccurs="30">
                    <xs:complexType>
                        <xs:sequence>
                            <xs:element name="nombre"  type="xs:string"/>
                            <xs:element name="apellidos" type="xs:string"/>
                            <xs:element name="nota">
                                <xs:simpleType>
                                    <xs:union>
                                        <xs:simpleType>
                                            <xs:restriction base="xs:decimal">
                                                <xs:minInclusive value="0"/>
                                                <xs:maxInclusive value="10"/>
                                                <xs:fractionDigits value="2"/>
                                            </xs:restriction>
                                        </xs:simpleType>
                                        <xs:simpleType>
                                            <xs:restriction base="xs:string">
                                                <xs:enumeration value="No presentado"/>
                                            </xs:restriction>
                                        </xs:simpleType>
                                    </xs:union>
                                </xs:simpleType>
                            </xs:element>
                            <xs:element name="edad" minOccurs="0">
                                <xs:simpleType>
                                    <xs:restriction base="xs:integer">
                                        <xs:minInclusive value="15"/>
                                        <xs:maxInclusive value="75"/>
                                    </xs:restriction>
                                </xs:simpleType>
                            </xs:element>
                            <xs:element name="comentario" type="xs:string" minOccurs="0"/>
                            <xs:element name="dirección" minOccurs="0">
                                <xs:complexType>
                                    <xs:sequence>
                                        <xs:element name="calle">
                                            <xs:simpleType>
                                                <xs:restriction base="xs:string">
                                                    <xs:maxLength value="18"/>
                                                </xs:restriction>
                                            </xs:simpleType>
                                        </xs:element>
                                        <xs:element name="número" type="xs:integer"/>
                                        <xs:element name="piso" type="xs:string"/>
                                        <xs:element name="población" type="xs:string"/>
                                        <xs:element name="CP">
                                            <xs:simpleType>
                                                <xs:restriction base="xs:string">
                                                    <xs:pattern value="[0-9]{5}"/>
                                                </xs:restriction>
                                            </xs:simpleType>
                                        </xs:element>
                                    </xs:sequence>
                                </xs:complexType>
                            </xs:element>
                        </xs:sequence>
                        <xs:attribute name="dni" use="required">
                            <xs:simpleType>
                                <xs:restriction base="xs:string">
                                    <xs:pattern value="[0-9]{7,8}[A-Z]{1}"/>
                                </xs:restriction>
                            </xs:simpleType>
                        </xs:attribute>
                    </xs:complexType>
                </xs:element>
            </xs:sequence>
        </xs:complexType>
    </xs:element>
</xs:schema>